,audio,transcription,speaker
590,common_voice_en_24563419.mp3,Adult male with African accent and deep raspy voice.,aca771df10297b946a2b6cfe7c40240a083f130ea9cffe6dbe28dfb2592fea1cc29e9523afb9bc2637e1b43dd22d233146e40ab799e1dc500934a426dbe51519
591,common_voice_en_22219398.mp3,Mature male with British accent and soft high pitched voice speaking softly and flatly.,790119216b38d50f5ba59a88b357ea933ee8c9e611e9bcf6f74c93783631958ea9579d6f5d8354a92dcbab34f52ccc800c761a0ba0c7867bcc1f668d3d414ca7
592,common_voice_en_684998.mp3,Adult male with unknown accent and unclear voice speaks quietly.,9de1b8e0243f4fa83f329bc2a1122dbe273ec3876c49beb3bcc896ca97bd60d89f4cf698be2e1ea016cf749675bb29185249542e666378ba61dfafc64903d84c
593,common_voice_en_21283098.mp3,Adult male with Spanish accent and lively voice speaking convincingly.,373d01c6ba799437c3cfaecf801403496cfe1e211dd474e04ad1fb6f5bd2b80e160f6379b86745d91914cb6059a54be65e39e2e5f1bf46c026c2bf60baed967f
594,common_voice_en_20038777.mp3,Young male with soft voice speaking slowly.,8bfdecc63205fbf2744eebbcf7755307a62641b0d96bf462b6f2b571f5e171022fdd1ff61d92a0e1cf72a39739c3150381e466bf6a1aa1f839bfc7c206ec3521
595,common_voice_en_21949748.mp3,Adult female with smooth warbling voice.,3da7e3447610e9e308ec373921d41f04ee61835573481962b13c2ba2dca8464266c4197a34bf85ec45e1e2d883e65b27f77bec864af68a1d082d48f56d2dd276
596,common_voice_en_19950508.mp3,Adult female with American accent and neutral voice speaks quietly and informatively.,8bceed4ecf28fa720311fdd24dccd2b5615df3bf5001d912caccd5f0c3b5dbde373b73ab59f21540f5e17009a599ddad8d6d6fe02976492c450c616ac53f79fe
597,common_voice_en_20781253.mp3,Mature male with German accent and deep voice speaking slowly.,372293e65cdab88771e028a4351651ab2eff64438ddafc211e089247dcdccca350153465eb5409ce708081d9ad384af45d1dc57bbe030ae1a2c0edd561322fb8
598,p258_018_mic1.flac,Young adult male with British accent and informative tone speaks clearly.,p258
599,common_voice_en_19679869.mp3,Adult male with Scottish accent and lively voice.,52f73216e3f175df56c7be2ed9813b15a64b037b08891fbab6d615b736b0c591d357c877a0f6403c19dd4df6b5600f29bf8fcd41be8dbcf535d98c7e5fd881c6
600,common_voice_en_18485775.mp3,Mature male with sympathetic voice speaking quietly.,e6b20bfc3930e7bc0bf0d661d5cfd01e271626f6170dfe13e13d64fe4bb20985124a5ebf13326e6a3c59338466cc578055cef3e9ec174653a51f0ac7362e6c1f
601,p246_078_mic1.flac,Adult man speaking clearly with a flat voice,p246
602,p272_295_mic1.flac,Young man speaking calmly and clearly with an accent,p272
603,common_voice_en_26969750.mp3,Adult man speaking slowly and calmly with a happy voice,3e4371f343e1d6c9ebec8216ad6f58bae35a9c048be9850303966009ca58b7bc05dc609f6df197a9aa357376b9999cb8f5ec0c9d18edda76c9b67867ab32d6ea
604,common_voice_en_15734416.mp3,An adult man talking with a Slavic accent and wavy tone with pauses in his speech,d1b4176aedd0ff3e7e6c135ee46a6a07fccc74486091892201ad4cc18e887f8f6cab40c80e69512a9d4507533a2b43fa0ca71b3c6fe0d7b911a0c46257c93877
605,common_voice_en_678824.mp3,Adult man speaking loudly with confidence but audio cutting quieter mid-sentence,e9d9ebc51ca7fc5ce96e8ba95b1d2431b1271fa0253561ae7fb96d377100d4a2639c3c107c9bcad326d5df41762a3320323f08446eb0f2fdf474e5983d7a9b73
606,p304_293_mic1.flac,Adult man speaking with a slight lisp and a wavy tone,p304
607,common_voice_en_23928930.mp3,Young man talking with a deep monotone voice ,3ebf9922255527d1c5a01508d3e3200a18a43663f6dec767bc5fd726c4d4c645e99580957d562c5996cb5f6745001fac4bd353595311b6080b07d0f92cfc9bf1
608,common_voice_en_26215523.mp3,Adult woman with an accent speaking calmly and clearly ,13d883887135cd255da515e128469ec568e336891f1b48f7839d29debaa059d46cafa767addc9c22ba21d3333f04a067b4e78b5f3bb98178e6908717150281b3
609,common_voice_en_22095650.mp3,Adult man with a deep voice speaking,4bf6a8447c3ff99dfd903adf11f2bcbd514fed0b77f26f4f616ada44fb86fbfa997a1540d148fb84a4dcb156451938398b05c74b838cb7988a5ed4813e08d059
610,common_voice_en_18404362.mp3,Young woman speaking with a slightly nasal voice ,f748c3446cc12be48e26ebea896c3422ed8c447593cb4ebea1b829cb299d1bd5fb6d9d0b08be0d399a19a66dc5241d83603859cc01caa939d3dff5059e02abce
611,common_voice_en_20883145.mp3,Adult man speaking clearly and with a low pitched and emotionless voice,e5c49349b46a5471e68d499248fcad692fe3b21ade0f6d322a5a0885bb9b4ad0a25c014960ef85b8e6c726966a89640f9044f515feb665f24dd6f415d701f98e
612,common_voice_en_17253926.mp3,Adult woman speaking slowly with a high pitched voice,1645aca50c6f33f976d363267936d93e909dcd2369c82161bbf42fce536bfaac95237c50b18b34311ddd9cd919b8413352512bb5c11e4f7b16cc9f337bceca8c
613,common_voice_en_27350975.mp3,Adult woman with an accent speaking and putting separate emphasis on each word ,acefbb332db5ce3a5176cabcf11976d544177c9cc2aa0341e37bf9831b07b0c93eea6bfc53d97214ab261d1debb927bf66afb61c88db722415a5af6545b5ed9d
614,common_voice_en_586985.mp3,Young man speaking with a nasal and high pitched voice and a confident tone,ad18305eb8ef4812f11208a027ce49d5e99dcc37b6c0d66ba1fa37f62f00bd7fa6712b6437f2a19c4239cecf0d51ba1605363621ede74e7e59c758421fb3dd24
615,common_voice_en_599402.mp3,Adult man speaking with a flat nasal voice and a slight lisp with bad audio quality,aeea4b94087062e08f3abd06d4ea743d8f2465d6238a15ce5587c5e006adc0696d85807e538447d996296316f49b60fa8f908305cd26a7154cceca03d74bb8e0
616,common_voice_en_18662849.mp3,Adult man speaking clearly and calmly with a nasal voice,7633e88d8d94bc5abe8814aec0a3388da1ca9d3355c359259eaa42413bd56892583a8343a89ea0e4bc6827214421325a8b9761c17b4a4b93f430669d4e081e13
617,common_voice_en_19087862.mp3,Adult man with an accent speaking with an emotionless voice and a flowing tempo,bef8c1a9e58b9a04e53171823d4a52e518a2171fb8de432721cbfdb0d7b9349f3cbc86e278b3f8f32914879e544635a0f14c0295f17ab42be47ea8b92df01da0
618,common_voice_en_696997.mp3,Mature woman with a Southern accent speaking with a confident tone,a41b49f8d6eeb4e645b0a2bda92ae9eca9b7e1ab97810f77041c7f813463519cf45983f4605f81d12857a23d579b70596d00e8a3a7563aa10d42115fe3a73d47
619,common_voice_en_22981571.mp3,Mature woman speaking calmly and quietly,7eff9a54bdb0619deffda7609d5b8565278e3328de99e63908be2a37c1ad16516240b9c92bc6b68d8130b20dc556f57005dc053f4874a49589f5971a31b97e98
620,common_voice_en_22071450.mp3,Adult man speaking with a convincing and assertive tone,9ce0d8b938f9fa78bba694f03596bf19589cdff83e9595d46de5de414ecff982e79a746534b19134bdfc3aeab0b4835736205a98ac33c37ce5b50a444eaa74df
621,common_voice_en_25024684.mp3,Young male speaking calmly with casual voice,580e3acc96bae53f5165594715de091a7b7881cc49e1f57cc903da26697918b05cbd14303e161e3dcc7f6df14b5b4806054f279b7739e64f016e1d0141b726cc
622,common_voice_en_19690114.mp3,Adult male with accent speaks with low pitched voice and some white noise background,be7ec154b8f7d6491e749304a7cbd6ca80393c9088735a701c932278794eb4e8146838493e38c0d59b2c1a2adfe9c9b653b9e7dd0ab2aead9b7d6714ad27950e
623,common_voice_en_17323878.mp3,Adult male with deep low-pitched voice speaking confidently,9031a0df3881deed09a4b6e4376a79c101b32ac89fb979aa0d223033226eced42aa0dbe05cd07abdfd5fad16ea07ddf96f2d1a401213b4ea42598854fc01e06f
624,common_voice_en_524164.mp3,Adult male with possibly Indian accent speaks with very unclear pronunciation and mouse click in the end,17d801ede71fd62fe267dd9e2e73da624c2bf85cae5e77fb320d5b994e649eecf5c08f55de03a6a94e84a6ecc9d1baf30165f59dd6ede33686a99757252e7d8f
625,common_voice_en_19656995.mp3,Adult male with Indian accent speaks with pauses and mouse click in the end,cb4525cf211cae9b367a6c62b873dcd232139842176a7dd88306823813e1b8dcb146d072d2a2d5f3614c476fe23372cf6b117e55dd5dbb324718f9b6e0ad29a1
626,common_voice_en_75484.mp3,Adult male with Indian accent speaking monotonely,f1ebae1ac4bfb4b1cdd57be76cf4df146f99c4fa18b4bcf34e138c876a3b2368bc768af4cfa22abdebd9ff3eefd8cbb74596d771f1c793915eb045f50d4f20b5
627,common_voice_en_23984863.mp3,Mature man with unclear pronunciation and deep voice speaking slowly and stumbling,372293e65cdab88771e028a4351651ab2eff64438ddafc211e089247dcdccca350153465eb5409ce708081d9ad384af45d1dc57bbe030ae1a2c0edd561322fb8
628,common_voice_en_23945173.mp3,Young adult female with accent with low pitched voice,645b900b88175f1977932459e76cc3d2b879458dc9355677bfb30b1a84824a8f0a9d155612c84621df6141afcbb014935e147545dc07c48a825a549ddfd9e038
629,common_voice_en_18762211.mp3,Adult male with low pitched voice speaks with pauses,7d27b3848638332eec5744cff5886f0f7ce81be1089947bb629d34ebbaaf153628f678b933e4272bff782156da879eb0609b8a5957041406346901cba2a96182
630,common_voice_en_19717164.mp3,Adult male with Indian accent speaking in monotone voice with slow pace,a29b3295085e1b9c620a62983d302f955a39b8faaf2e49455ff8209baf82a74c55c56d65a90d3fd4be86c51d739fcb9a22fd340d95f089b17f84cc4941ce3334
631,common_voice_en_19540822.mp3,Adult male with Indian accent speaks with low pitched voice and unclear pronunciation ,a5f003c7f0c8326efc702a479006a77a96835014290529832e54746dfa1617778143fccf0997cf5572318c3155cbdc497be11685914c61aaca3e5629f601ad14
632,common_voice_en_21916766.mp3,Adult male with deep voice speaks slow and convincing,0b1367f75919eb75f7bcc1596195cef7cc9740f4675d894d2b5abe93d338dc76d2eeb01bb4487a6a35f3c3019e5e0d0af0c35003458cd4b25465bfe4b4f2202e
633,common_voice_en_64345.mp3,An adult female speaks with menacing voice,a76997b9160ee10abfd6489d0197039bfb003bce91b063032e5b725690c72211ec3d14848d1a320c9e6ba116780e28b4c78137e8eff2c1e7b7100b45deda13df
634,common_voice_en_17276794.mp3,Adult make speaks with unclear pronunciation quietly,bc2636c9ecc91bea673691dd8783c6d89335c2da6b5264c9486dd2968a23e5b3b7f7b3b2eb3b24f8b219c7e36587c8ea8dab61ec6b9ef37dfe285e1b914cb105
635,common_voice_en_25316542.mp3,Adult female speaking with convincing intonation making relevant pauses between words,66bfc2f1fed1461f58663170fd2db7d63f04f731d9e9121e17e3c3f4f7bd3f763eadb47640acb11e3b387f9f9a70547fff961797817db43b6e4e349ee76ada59
636,common_voice_en_19019510.mp3,Young adult male with French accent speaks emotionless with sounds of breathing,02058e0159c455fada6f5a9272522f0457446aa27235641a34769cab1287118655764373bc6b042f89ae423af46a0f461cf0f5fee36e234ff4cde596ae6a1fee
637,p351_051_mic1.flac,Young female with American accent speaks with upset voice,p351
638,p301_020_mic1.flac,Adult female with clear pronunciation speaks emotionless,p301
639,common_voice_en_594214.mp3,Young male with British accent speaks with informative voice and talking background noise which is quite loud,baf18f49afa25da956edff78f73a098e3bb53d62be3dfc12756cbaa322641034c45fe02d3add4f87d33a6cfad788e12fe38128955fd24c5fcf2c5859cf9d9c61
640,common_voice_en_20196824.mp3,A young female with Australian accent with piercing voice,7963691c43c8cc498c58f117527522bf772c76c38530570bc55ef04834f67fb7a9227bd0fa1f13e64e8de1cde6594f3501e172ab86559697c08726cac26f4c6f
641,common_voice_en_24607066.mp3,Mature male speaking calmly with deep voice at a slow tempo and unclear pronunciation.,ea6af2f035b41b076462b218d20822bcf91a491c7b894e6ae5df8721003d07e28894b3ef0b8093e857238a3d7fb363ec6687af9548cda5437399c30804eb5b67
642,common_voice_en_23697869.mp3,Young male voice speaking in a formal tone with some pauses.,505d3052b731e49ad6c4f40931ba42bff7a9046b894c676803a4044fead6272d3340ac3ea1fdf441cfed2fc4b1c81b85bd1fab484d7d9d86357b0affbd0739ee
643,p250_281_mic1.flac,A young female speaking fast with a clear voice.,p250
644,common_voice_en_16016.mp3,Adult male speaking with a high-pitched expressive voice in a surprised tone. ,d0c1ada02ee320e70ddf95315916b9b781c733c12d5e3d2b670787004da583f01f7bbb6189f9ffd3275a0f30aca7c7e49a61b3911c2d249e4168a6a58f9895f9
645,common_voice_en_20183218.mp3,Adult female with a robotic voice speaking with chopped speech.,3dadaf13c9f244c187466942367d1da68cf1ba3fd4c5a5b27614964bc19565e566d5daea151b505599991d84b7d5faf8db2afc26f992b1bb7b99004b1f5b36f7
646,p287_401_mic1.flac,Adult male with a deep low-pitched voice speaking very shortly.,p287
647,common_voice_en_18865048.mp3,Adult male with high-pitched hesitant voice speaking with pauses and with some crackling on the background.,064a2016c00e4edd9c4434e457a6beb17410df70500dd1d11c52fccd6ac7c5a7443504e27dc2dcc5e92ccc939c3bf8ea12de379c90c3f8ac250296e84f5d2fb9
648,p237_218_mic1.flac,Adult male speaking with a deep serious voice.,p237
649,p294_099_mic1.flac,Adult female speaking with a low-pitched voice in a disappointed tone and audible inhale and exhale in the beginning and end. ,p294
650,common_voice_en_22047115.mp3,Young male speaking with an accent and a bit chopped speech. ,4e06b91cf792a0e998137fe8fa85ed530364646538a026da9eedb47110511fdb8960c3913410916c84117de4f866c6ebca4a10a608e3ad85a2195ef8f743fa0c
651,common_voice_en_20367332.mp3,Adult male speaking slowly with a high-pitched voice and incomprehensible speech. ,8cce568c89a3613117838c3e6e9492f6d25f6518b278c27a5d4a94e273b92c81ba7285db0139678cf4292d0432cbf8ef171681e564f40bfce00de6ab9f496eb1
652,p275_217_mic1.flac,Adult male speaking with a low-pitched emotionless voice with a bit unclear pronunciation.,p275
653,p265_237_mic1.flac,Young female with an accent speaking with a sharp confident voice. ,p265
654,common_voice_en_17396887.mp3,Male speaking shortly with a noise of something like an engine on the background.,95ae70d2cb8fbf62dd78632bdea59192cfd6769d9a02d1eafd6a2031e96c74a3dda74b5ef971f0a3c3cbb3e6df6d1d9640dac1539e77069b497b086d0ab70ff6
655,p246_035_mic1.flac,Adult male speaking with a low-pitched clear and sharp voice in a confident tone. ,p246
656,p288_380_mic1.flac,Adult female with a British accent speaking confidently and calmly.,p288
657,common_voice_en_550875.mp3,Male with a British accent speaking with an even neural voice and audible clicks in the beginning and end.,6188c850945f10617f98757bde98a5ad9ffa15eab2a844f81d59514c08b09bf636c73810436a15b17bdf87a5c9888283d73e2828bc1b46e8e77ef2f3ee479220
658,common_voice_en_17363025.mp3,Adult male speaking with a confident soft voice in an inquiring tone. ,13c8f9891aaa4e30a1071245963631d51579b9ae6a4f3277b6aae4467ea1811e6afb9f42348d4acfbf1d183c3d137a8715bde9597b7abf8c908340a83d7fe1a4
659,common_voice_en_138397.mp3,Adult male speaking quietly in a low slow voice with an accent. ,535810f407b6c7dd1a8a967fd604a3dc88418ae5c9bfd71656c0d14e3247f1484e2c980ae764aedd659b61e1d1d462c00c430af253f87c1f47fe0e60bfd7b0d9
660,common_voice_en_27495173.mp3,Adult male with a British accent speaking with a confident calm voice. ,d7b8bd57a847b9f6a92eb975f2fe0a8686ee95a9e71b0168d5ee36090c94b373186a93d864491807465a14b0cb0cd867c6a52509095f73cb3c58490f0fb7f149
661,common_voice_en_27311844.mp3,Young female with Indian accent is speaking with emotional voice.,a1960f07d823fcb9e8eccca859b92483011823383ed30bf4493ba24237cf283f0d0ab396f9094d310e825006f8480f0bd0cd5bd867bcabc45acce93a3a8325a2
662,common_voice_en_18658131.mp3,Adult female with unclear pronunciation and emotional voice.,7963691c43c8cc498c58f117527522bf772c76c38530570bc55ef04834f67fb7a9227bd0fa1f13e64e8de1cde6594f3501e172ab86559697c08726cac26f4c6f
663,common_voice_en_25567824.mp3,Adult female with low-pitch voice and clear pronunciation.,0eebf7d01b8206da364c99ef90653c9b680658ab74002adcf257a19f1b826c808ff63190b0f8599a7cf481f737e62d9abd10100a5b0252caf324e66e407d55ce
664,common_voice_en_18105268.mp3,Adult male with menacing voice and clear pronunciation.,64b9623abc2396d296ea4a014a54d7eb8ab53b36957d346fa2785f7400443f55816b226ad1ed09ad13379588b5082312f78e1ed167207d960c4eb51ab6491ebb
665,common_voice_en_26085341.mp3,Elderly woman with British accent is speaking with pauses while kids are playing in the background.,2e20217a8efbee034f3a9131c01c3aa3f395c3948d87eadc6bef2425829ac7e50c4528fc4791f14e11da6a7c2fc31e17f4b8649b917575f240901e0c84f7d543
666,common_voice_en_204606.mp3,Elderly female with British accent and clear pronunciation.,6decda3c2949d842e2b58174983c22d2fdbf0887949928fbe5067ad8da732b131c9abb3dc63c1d4ba6e2e1bcace49abe928a61260b4d39f09bb56ac3e6a9e35b
667,common_voice_en_26950773.mp3,An adult female with monotone voice is speaking with clear pronunciation.,8f952b8e7cff2dda3bc3f9f3b50a5464a99a8c27f1b7540fba9babcb39e2c76c8a3b451cab0a00f34e1e17df255532c17e86307a80078272b33a7936119329ee
668,common_voice_en_25730789.mp3,Adult male with British accent speaks clearly.,9d963f524378d4ad26021eceba4ccc302f28d4cf50458f84aee557105c110dd74840577bb3822bd4859ab98a411cd5a0e5b954185a7cd66d95c8a17fc944f36b
669,common_voice_en_23887375.mp3,Adult male with deep voice speaks slowly.,3ebf9922255527d1c5a01508d3e3200a18a43663f6dec767bc5fd726c4d4c645e99580957d562c5996cb5f6745001fac4bd353595311b6080b07d0f92cfc9bf1
670,common_voice_en_77627.mp3,Young male is speaking with clear pronunciation and convincing voice.,056861a8563bcd33d2faafb79fa5fd3d4f0daccb7bd2cd9eaa056241f316255c80b54c77844b3770b0d9f86beb31fcdf4fdaeb14550a90174a67542d4d9a47f0
671,p234_250_mic1.flac,Adult female with clear pronunciation and monotone voice.,p234
672,p230_127_mic1.flac,Adult female with clear pronunciation.,p230
673,common_voice_en_146724.mp3,Mature woman with unclear pronunciation.,694d7f39e20701d65b424549bae7eff1a28276dd922e0ff743af41f8800c91c7494cea94e7fd82e9afba11d8d1eef9f92cfc6f621852367410995a8e4a430f55
674,common_voice_en_27304005.mp3,Adult female with Indian accent speaks while out in the street.,63a4e47b6d3cfd98330c334e868d3c41685834cfec2c5c38865472410ca2fe8e204cf0758be426b09c7785bddf1354610f63dd1d2ef4e4eac6e23e1455235417
675,common_voice_en_24702374.mp3,"Mature man with bass, deep voice is speaking with clear pronunciation.",6eed81f7feb81e2a32ce4a0f0ff8d4127b1481831a06c353b6855d8cb54fe08c8a54073f78874c8e5799fa5a63a620f3cc61e245cbdfe0ad6bdad4899bf5773a
676,p297_292_mic1.flac,Adult female speaks with clear pronunciation.,p297
677,common_voice_en_26033651.mp3,Adult male with unclear pronunciation.,84851325d788471ecbe1f5dae31c3694c779bc917a4c6d5ea31f8181f28f15c9e5c2bab85850108c5c5b78f6086b040cd5322fa143ada4596f62ae0f40c01adf
678,common_voice_en_19150988.mp3,Adult female with British accent speaks with clear pronunciation.,3db4d991b3de584e9bf5ebdaffba6dcc4aff31cc074b46bb3fd174a97ebb679be42e747df634081b3fda5aebdf5ee528ec08751b67f698bc6c9ad5fadfc60c76
679,p247_433_mic1.flac,Young male with British accent is speaking in frustrated voice with clear pronunciation.,p247
680,common_voice_en_108144.mp3,Mature male with unclear pronunciation.,776abbe3816d7111035c467b02308b78f7358d9a0863c6a611a1faae3253dd97cae84d0453167bea4c99f70791d135724b8687dded7731e908d83f66f8e6458d
681,common_voice_en_20013714.mp3,Adult female with unclear pronunciation and mumbling speech stumbles while speaking.,7963691c43c8cc498c58f117527522bf772c76c38530570bc55ef04834f67fb7a9227bd0fa1f13e64e8de1cde6594f3501e172ab86559697c08726cac26f4c6f
682,common_voice_en_28858024.mp3,Adult female with deep voice and unclear pronunciation speaks with normal speed.,5b87f151126f038f6d1e214d12b2d1e621b5dad0a77477f54d846d62a56ac089410a6fdd2cf88e8c1bca920c175e8a7b46643c3cb7b762577e255c81d51006ac
683,common_voice_en_544251.mp3,Adult male with a low pitched monotone voice speaks fast.,15378ef268e1b62e07410dc9a23cad0468d63daf5468a410b243552873533791ef1f9a9b082d82e64d2070babe141d326c930c074a50423b848219d10e7cf938
684,common_voice_en_25250798.mp3,Adult male with deep and friendly voice speaking in calm manner.,141d2fb979ebab495f92c338e4ca2fcc5a9d7b10f19be3047972ea5a0656809b99460f8afa0f5b12848e69becfe6185ae8f44f773289568ba1745fdbbdffaa82
685,p285_214_mic1.flac,"A young male with a calm, flat, and low-pitched voice speaks convincingly.",p285
686,common_voice_en_121679.mp3,Adult male with high pitched and serious voice speaking convincingly.,93a5d68bb49a2aa81688b59d1db28f6fc04297bae84ea9a09f032ce4c629ede4ef32debb884a5afe6f4e544ce5846c18e62edd17ca1f63821ee5b218def88512
687,common_voice_en_19650389.mp3,Adult male with an Indian accent and mumbling speech with a background noise of beeping.,0790b6c27cd5665b6353c0c472e3caf40ace21defc77b725ac194a66a8965800fcab49eeae7e3531b2c07f6db726f67f5703f0c29c2ee7785a02d50f3ed4665f
688,common_voice_en_27366072.mp3,A child male high-pitched voice with an Indian accent and stumbles while speaking.,af294a21d920e11013661f4735c1ebd5df298b0c73074b35ae4c3ea490ee8e630766fc629741346f123353256859ef7d055ee8dcce07e48a091cc8bedec671e3
689,common_voice_en_582683.mp3,Mature male with unclear pronunciation and convincing speech.,edf75d480c429c7a479f0b3d10eede99703b7642e0768291492c3fe58758d31bf52e8a34e4f12e8d024ccaf63b26225c2353e2b146f9dc8b8e234ade30c1f85c
690,common_voice_en_25888979.mp3,Young male with high pitched and childlike voice speaks in a curious manner. ,9e9081b9bdf3e0a0e94f318f3e7b554a6b04dfaa1ee799564e55a70099b461ece00fcef86aa34f02fc316ea91e1f1335ec8639cab1622560badf8924ea1fe858
691,common_voice_en_20387302.mp3,An adult male with an Indian accent and a bit high-pitched voice speaks convincingly.,f22579bbf2a6f8f989d574f89b882c81563a635ef107dbe80c669537bc18a440cf038e8aed1a5d398fce8f1570c78388a460aa8ff95f9b16d13e94b954e307ab
692,common_voice_en_17779074.mp3,Adult female with a deep voice speaks emotionlessly.,3883f719d95b1d18f1541e53f20fcd645d1cf454977e0c0d5fef0fce4e6ac6f8b334439b8f0c4f8d945fa2681a1cd3a8313011561d0f33566c65a71290f657b5
693,common_voice_en_25507880.mp3,Young male with clear pronunciation and a bit high-pitched voice speaks calmly.,c46b47eb5d1c58daa8212ea8ef73c27d0f4ff0f44d8a0e63b0f3114f7a4f2074e010af4cb5df24bbf29dc3e0fd52f637964602d3f50fa1007a3bc2bd7dbb9690
694,common_voice_en_19963001.mp3,Young male with high pitched piercing voice and an American accent speaks with normal speed.,3dfaebab35975871079eeabb2014a69f30c76b34a44baf2b58a2f099495c9a919c29e4e99f4f4d509b295cd4eefc0a1a3e14a70eef3ff07304e76daad0ed6a6c
695,p247_255_mic1.flac,Young male with a British accent and clear pronunciation and a serious voice.,p247
696,p270_064_mic1.flac,Adult male with clear pronunciation and deep emotionless voice speaks calmly.,p270
697,common_voice_en_25198718.mp3,Young male with monotone voice and unclear pronunciation speaks slowly.,0e0355c90226ddfaaf1f6eeb5a62b81e1ff0af2058fe3e6cface5d913093866b348b53742297c797b75ac9552f9b05a829fa8dc5d30d6cc3d75224d911e74253
698,common_voice_en_27143978.mp3,Adult male with calm and deep and monotone voice speaks slowly.,882f4ed3e80f2a0d6cb038b0f08563c7b3c067c0cabc3735de113975089160c856405971c55436ef7a8c838c2cfd085be4976541e14d11a83b92cba9017bee49
699,common_voice_en_17296727.mp3,Mature male with a deep voice and clear pronunciation speaks calmly.,6e6528b822213e5cc9f7a4ca6ee2507b0a20c73839a5a92021f53ad1e70784e34d10dc11a2ceaf3843daee8ad8bfae5137dd697bc4301b9a6e5815815f51dcf1
700,common_voice_en_572419.mp3,Adult male with a bass voice and unclear pronunciation.,6d8639d35f282fab730f5debe3b4899f5331f578452da7d0f9605ad3e134a78c38f5d0c4211699fed042e6a47e965de6733a075ebf81b73719801f54fd31c381
701,p228_190_mic1.flac,The woman in the clip uses a British accent speaking fast and medium-toned.,p228
702,common_voice_en_151360.mp3,An adult woman speaks at a low volume with a convincing tone. She sounds American.,c834d09620b172dde948722fe962de129fabe18d56417899b729f1f383a2712ed5b61ef891535c682cd438bec764c2b2ec861ec26c684ac24b20f7b35684797b
703,p277_419_mic1.flac,The woman in the clip speaks fast with a medium tone. She has a British accent.,p277
704,common_voice_en_23352819.mp3,"The mature man, probably an Indian, speaks clearly and comprehensibly.",920b6c82ac5aa138428d3463675577c9caa74b9e9bb48f6c7571d66979bc5afb85e73a5695c405a50d44522c4f6058e54992737c040467b1d7698571c17ca7a6
705,common_voice_en_19655255.mp3,A guy with a seemingly Latin/Spanish accent speaks slowly and unclearly.There are also background noise when he has pauses in the speech.,ef187f80e8c8ce7906e882cc0392bd9f966606b1f6eabc3cd983362dd98fb35542a2254e8e95aee65e961e987b331dda941db7cbe9c18915bf80412a2c3dc9b7
706,common_voice_en_31291710.mp3,"His voice is deep and emotionless. He has a strong east-asian accent, probably Chinese. He could be at 25-30 years old with English level around A2-B1.He recorded himself closely to his microphone.",372293e65cdab88771e028a4351651ab2eff64438ddafc211e089247dcdccca350153465eb5409ce708081d9ad384af45d1dc57bbe030ae1a2c0edd561322fb8
707,common_voice_en_19113801.mp3,"An elderly man, possibly British, speaks in a deep convincing tone. He has a tempo and proper pauses in his sentence.",b46d39377dbd8cdc64a32072992b3dd64598d10d56ae41b2f35be11a4f720289768b4202c7daa085552bfe06c96a8021d8003f59bb76d628585e962934f683b9
708,common_voice_en_22475576.mp3,An adult man speaks with a flat calm tone in a neutral European accent. ,b9db4e5fd24c684a86b29fd4db89bc69b2d20243c01548afcf1b9fe317386b5bd8ebf01db11ec112c3088af189ecd20409566804d6ac8e1c0ee584d98c3e5484
709,p236_412_mic1.flac,A lady with a British accent speaks in a high tome rapidly.,p236
710,common_voice_en_668149.mp3,A mature man with a deep voice and a neutral English accent speaks slowly in likely disappointment.,02718e6068e2d4292ebb32deaefc1cb424d3bf323c8fbd29225d1265b58089ef26ad1e5295382ecd05c48a150ff399f46d10059e2491b98ceb5b08c498afb1eb
711,common_voice_en_17265637.mp3,The man in the audio speaks slowly and clearly with a neutral English accent. There are a few pauses in the speech.,fdf639ebb01299345dcc612cac9f4fcdadf5004c349a8ddeaf69ec6ee7878dd05a8656597cf87590c63c5ffb23673dcd0e9a37aee41e70469288a37d4ce5d1b6
712,common_voice_en_19845240.mp3,The guy in the audio informs audiences about the standards of different brands. His voice is a regular American accent can be found at work.His voice is in medium tone not too high or low. ,a745a27d724d52417c1342b56bbd8941c029c0cb740d1218bd8e51ea42a5d4e2f97fdcc68d6ac8a297c07d8cae746968269009fbe0cd2092f30fb2633e292ca3
713,common_voice_en_22859654.mp3,"A guy with a non-native English accent speaks in a soft, fast and medium tone.",653da95aa2fbb1199761a74c24af46318735c1f189887987c9344d1945435e2d3e42487bebed73aa32fdc9e6539c099bdf168b1b2b94b831025cf3a476f6fff8
