,audio,transcription,speaker
480,common_voice_en_18496805.mp3,Fast-paced sentence told by a male with childlike voice ,939991dfcf12d8250739f3b4e5ed47e0dc4bf8ffb69810f4ab853aa12872a811941be35b7e91af5df8350d75d3c61d1301aba694c41deb3f38f1414703bc0461
481,common_voice_en_22274405.mp3,Deep guttural adult male voice with American accent and clear pronunciation with calm expressive speech.,32b1515bc346924bc29b0cdda3fc2a96d2346966ca28af556d3c1c4143a36f899720bdf0c2d0c966dfc6a8dd05e08bd4bfe13bbd477f7a828cd0fee7d031bfbd
482,common_voice_en_642511.mp3,Low pitched hoarse adult male voice with American accent and clear pronunciation with calm modulated and rather convincing speech emphasizing some words with static noise in the background.,60f860b1028f12bdf2404db908eb942580edae5bbf7f74187b0a2cbeb88862a8f7632d152b18b0b059ca18ebcdde7688099012c55acd5b5937ef0a64cf99e5c8
483,common_voice_en_18753026.mp3,High pitched piercing adult female voice with unclear accent and unclear pronunciation with slow-paced chopped speech and loud rumbling noise in the background.,905290e6c425fbf58eb647e6e1882d5e687fd6a720de8c34564950251369c1cea398a674f7a55dc88efe433a021d0d368471417bc22966d648fbd1b02e034909
484,common_voice_en_28298105.mp3,"Low pitched adult male voice with American accent and clear pronunciation, with a rather calm monotonous speech with pauses.",757beaeb3dcab1faa1135fbbebc9a4315e7a569f749fbe21a8816905a981bec0b5aa2fe402d60d902cbc2fcaadbd204e02d7a72d388b389e9d7ff3b170f879e1
485,p260_013_mic1.flac,Deep guttural adult male voice with British accent and clear pronunciation with hasty energetic and rhythmic speech.,p260
486,common_voice_en_28337233.mp3,Low pitched elderly female voice with American accent and clear pronunciation with wavy rhythmic speech and convincing modulated tone with mouse clicking in the background.,af9c15b78f47fc932ee4a2fab15488dd4295f87b2a3359c855aad4f383b20bced882b0bb7ffa51fe7a08897bcd7370705108bb2cd7dd3919806d7d39f2209c7f
487,common_voice_en_26579114.mp3,High pitched piercing young adult female voice with American accent and clear pronunciation with slightly rhythmic speech and static noise in the background.,4638c9b4e22b8ba91a9a5d2e3906748f55c17e2b8474148e16177b4634987ceec72f9151af9825bdc3de2c0b9d3a542f849bc8960cd43b5bb8bcd141100dfacb
488,common_voice_en_483814.mp3,Low pitched guttural adult male voice with German accent and clear pronunciation with confident expressive speech with small thud in the end.,f17adb9640dcaab1d0b2ca54cfd766edcdcb73186fcff8fc9f39483edfe397d24feff56229b30fde90f011870147bcb9962986c148f4e632f39d9ea195539028
489,p333_086_mic1.flac,High pitched slightly nasal adult female voice with American accent and clear pronunciation with rather fast-paced rhythmic speech.,p333
490,common_voice_en_27521450.mp3,"High pitched young childlike female voice with unclear heavy accent and clear pronunciation, with unnatural rhythmic speech, loud rumbling noise in the background.",0b3d55acf115fdf88131d7324fa9a7e1a26542405b0671d5ec0d9ed34b40fa0158576fd51ee9cc937a41b1c529f49cfb23fec693ae1382f21ec8fed796a9dece
491,common_voice_en_504514.mp3,High pitched adult male voice with Indian accent and mostly clear pronunciation with slow-paced rhythmic speech with clicking and white noise in the background.,0b243da4d205259f6c9b53b7d5cb5804beb7656a424e868915fd406966d85aad452777bbb51809a7fc4b10a66703cb022813b781be138bda466562d50fb02efe
492,common_voice_en_18834685.mp3,Deep guttural and husky adult male voice with American accent and clear pronunciation with expressive confident and wavy speech with mouse clicking in the background.,47cd6e7c8d8fbf59a7527e2e7638f101bb0b5bd7f0d44c79c85da7a2cd818026ea249a1359d08c8ae0a050feeab9f803d54132ac0fd592e29c66efc1faad2c91
493,common_voice_en_29172730.mp3,High pitched adult male voice with unclear accent and clear pronunciation with exaggerated loud and slow-paced chopped speech whit rhythmic rather emotionless tone.,13bc17d3252356a0b6cffb5fd9135bfc0667268274084e02d91a415e026c3e48ccc671490ccf1fbc17804013f25cc3c313087801a7125394c59ebe6ba43b1da9
494,common_voice_en_17280961.mp3,Low pitched adult male voice with American accent and clear pronunciation with hasty rather emotionless speech.,6f607a09d0ea97c021420eeba81b48bd6833995fefbae48cb64e078e79b0a7559fd11cd3d0537ec8cd0dee8dca681d3efad2bc31721834a9ade7dcd80edf9508
495,common_voice_en_17994242.mp3,High pitched young childlike male voice with probably American accent and loud clear pronunciation with yelling rather annoying speech with a child speaking in the background.,44dd5216ea556ffe1d6db4695ba427aea5d187557e8a8aeac03f279f9115247c16ddc5b8a67a60bdc8f2a3601bcc1feb15b0dc8f505e20bd823163b149a1ac1c
496,common_voice_en_26960553.mp3,Low pitched piercing elderly male voice with American accent and clear pronunciation with loud convincing and expressive speech with crackly noise in the background.,325b1b8f976d8d5753a57ed49ba163e572b41ecb454726b3fda8a625df4143364a1a5630f772854b864a54c141c18fcd36c4bc416d424e701e37cb1a12c3668e
497,common_voice_en_17264250.mp3,Low pitched adult male voice with probably British accent and clear pronunciation with emotionless calm speech which seems a bit mocking and also soothing tone with a mouse click in the end.,2863c7bc58ab2c3ce384f007ef8330a5d87a89f5d8b8ce28af137136917c7b175e5fa0340e4fd055d45bd6cf319696855f192e1b14707b805bd07d446aaae781
498,common_voice_en_20825906.mp3,Low pitched guttural adult male voice with unclear probably Irish accent and clear pronunciation with loud singsong speech with slight echo in the background.,4193ffe3cdfcb7c00e37da775c01bcade8580bc70e0aad0a910000659d6c140437a77f838b1604c03c60d2268e0d7e55d3af8de808beec2c801136ffffb4cf06
499,common_voice_en_18518374.mp3,Deep guttural adult male voice with British accent and clear pronunciation with slow-paced calm and emphasized speech which is quite convincing and vibrating tone.,f3d92691cd471e1c8127d5b07eed54674bd97af10bb384803cf7c9548e79f6e9c7b79a01d9fce0fe59fcec1507dba62898ee53d053f3f7a43762bd974436c522
500,p245_220_mic1.flac,Deep guttural adult male voice with American accent and clear pronunciation with calm confident and modulated speech with inhaling sound in the beginning.,p245
501,common_voice_en_18775690.mp3,"Adult male with sullen voice, little bit disdainful, clear pronunciatin, but sounds unfriendly and unattractive. ",90a2539a7010c22f8d1379231f2b3e5829a0e645060d823d4421f270950a0c5be5a4c17dec76306c383f14de9ce8360149cc679dd60a951807e7650edf6d2bd3
502,common_voice_en_26466902.mp3,"Adult male with high pitched monotone, Indian accent, emotionless.",0e1a67fd6f6f4af5adac982ce60a8ff66dde09db82d2cdddae6bec79276a2c355cf3893fcdd7e47e0a3500c64ebf41b15b5599643bc457ab5a0757769a0c9f99
503,common_voice_en_63311.mp3,"Adult male with German accent, mature and high pitched voice, talks slowly and seem sto be young or middle-aged, has medium intelligibility.",1f4e890a95e2848cdeb5b67483e6314739e444af2ce5e3e90801fc307adbf01775428917e404260287ab1eb7160763bb97f51d0c56466e714e355cff9ff89d00
504,common_voice_en_19931383.mp3,"Adult male, young man with firm and formal tone, has low pitched voice, clear pronunciation and good intelligibility.",b419faab633f2099c6405ff157b4d9fb5675219570f2683a4d08cbadeac4431e9d9b30dfa9b04f79aad9d8e3f75fda964809f3aa72ae9d0a4a025c59417f3dd1
505,p314_379_mic1.flac,"Adult female, rather young with metallic deep low pitched voice, talks with clear pronunciation and good intelligibility. ",p314
506,common_voice_en_301774.mp3,"Adult male, a young man with rather high pitched voice and dulcinate tone, has a hissing ""s"" sibilant, talks calmly and with good intelligibility. ",eda6aa00b1339a26f37189450000097a4c9e07b148a024d9129d09a80e457be5708a79e603755795f5eb7f8904ceefea0817a59c40471318929cc5c5724dc262
507,common_voice_en_655369.mp3,"Adult male with mature high pitched voice, fluent American accent, casual and conversational tone and good intelligibility.",50621129ff7cff1c7952acb2bc3419e49906184af2f0dd6b780db8cceb7500d1cd9ada428fd29df880e134f7de4494cdd1ba4113fa47dba7f85e41f76f26836a
508,common_voice_en_32259953.mp3,"Adult female with confident and casual tone, sounds young and has American accent, has good intelligibility.",23155b3c9b54685ab85e13f624e6e07bd88f4280ce08d3e2cac43dc044c9aa8ca68d9cf70689d485319e8d91a60b6d25089f57ffb8156d07bff67d67f1a0a8e9
509,common_voice_en_592398.mp3,"Adult male with unclear pronunciation, very low intelligibility, high noise, speaker seems to be sullen or arrogant, but it is not understandable exactly due to the poor quality of the recording.",b1544dd62710516ffe8ee56331532db63d213e8c528c07c70e9331bc52b51c361c9037a297b02a4d34ea760d1151ca96762a10d01b7c601c72b658b43c3bedcb
510,common_voice_en_18013140.mp3,"Adult male with low pitched emotionless voice, sounds middle-aged, talks slow and has good intelligibility.",e790d1a6d652b49b74172d96fca249c1d46c38806613534de93e324492059b41bb491639158ff5b5efe117d167447b1dca743bff0b32dcfe07b12a43fb13a86e
511,common_voice_en_32815728.mp3,"Adult male voice with deep, seductive and low pitched voice, talking in monotone and slowly.",c6e13f9f057657baa4582764a6c52d6a7786a748b22c04771f680359e65765e20aa121c8ae40fa2fe36d8f13ffe57ef031434624a61ee4a558425f0a50dfa79d
512,common_voice_en_87554.mp3,"Adult male with mature rather high pitched voice, has an accent, talks fluently and clearly, sounds rather young or middle-aged and has a calming soft voice.",1d5071063730fea782e43765eda2a1929f69e4174b5d9c2c8ba0b35d18bee5da18ce8384a707e631851fc40608300291801b629b61a449e6a13ce034823302df
513,common_voice_en_18403174.mp3,"Middle-aged man with mature low pitched voice, has a rattle in his voice and rather soft tone, sounds dull and formal.",5cd95c7c22c6fd21f386f93b700187d1559ab9a63eab1b44b4af4717e61bee61dbf54a0de0d35e3014a441bc557f5a0a4d36ad4e3a815d4bd3c395c9e98daade
514,common_voice_en_19795948.mp3,"Adult male with British accent, popmpous marvellous tone, clear pronunciation, good intelligibility. ",34ff5ad8db33561f4bfb74af391c451a0368e5ec0acc299f526a28bf2d18b7321eafb89138fd7fd867be609666eb0ea65489b1323feb0c06af4307c9fecdd6a2
515,p265_319_mic1.flac,"Adult female with mature voice, attractive little accent, clear pronunciation, good intelligibility. ",p265
516,common_voice_en_32427592.mp3,"Adult male with clear, soft, harmonious, mature, low pitched deep voice, is soothing and hence attractive.",6fe2ee910553691f58721e526b2c255075a174ef8ce2abf6270d8156f986b92371f95fe33b57ad3dcaa7130f764456b3e7ec431dce9e01e2656b29043fb309a0
517,common_voice_en_61398.mp3,Scandalous and very emotional woman with pompous toplofty high pitched voice.,a457d6cd2e9be32ba26c13d9dda4e24950d858bdff83266976cd7187e17de1a88336d870d1df3c97f59153cff235e9242ffd6d7fc6386aa21e37f987bf4abce6
518,common_voice_en_42024.mp3,"Adult male with nasal low pitched voice, fluent speech, clear pronunciation, good intelligibility.",926bd6226fb4570a0e0b080aa55b00b3332b18ea7febeb0e0c953ff48c1f99eb6e10ce42e56efd8cfc9b334b2d70b4ea341fa157922d5805b13357076ba39ec6
519,common_voice_en_20007933.mp3,"Adult woman (middle-aged or rather elderly) with professional authoritative voice, clear pronunciation.",80bc1b579e4a1c2654bd8c5c672178cc6a45f1d7694d204330b3aeb0fa70f15c1051ca0d347484faf2a1bdf994da8f7da5e1723a05528ebb39e6236ce39e5591
520,common_voice_en_23385317.mp3,"Adult male with calm academic tone, speaks formally and emphasising each word, lacks of fluency but has good intelligibility, by age is rather young or middle-aged. ",9113297eafe2b10d7da3da867a64514deb39c1ae3020d7385f2d92c8525a990d9ae94d8a6f272c1e359b3834bdfe96332227704c99e4911c3de2a84215e451fb
521,common_voice_en_20527411.mp3,"Mature male with an accent, lower unsure voice with a pause at the end.",372293e65cdab88771e028a4351651ab2eff64438ddafc211e089247dcdccca350153465eb5409ce708081d9ad384af45d1dc57bbe030ae1a2c0edd561322fb8
522,p294_262_mic1.flac,"Adult female with great pronunciation, lower clear voice.",p294
523,common_voice_en_22002552.mp3,Young woman speaks confidently with jazz music playing in the background.,84028affbfdce37433291e1489dbfd77bd7bf54e616fd2ea20b3e66b9b5ca8fee35e64314a0962bf0abaabf123bc7679f3a42e951192c9236f218e742e86ad15
524,common_voice_en_203523.mp3,"Adult male breathes in before speaking, has a bit of an unclear pronunciation and variation in voice pitch.",49866d5040065a6cc5c969c61dbed200966dfef924984e3fe9d5db284ca635e18a727cd70f3b94b8d7f9e2777bacb3f44f7b329d3ca65dba73fb3a8bc452507e
525,common_voice_en_469924.mp3,"Young male with high pitched voice, speaks calmly",72778e2b27af78771a5490c01ee205ceaac7b3cb9fc5c5e69a4c432a72bf571f51b1bb5e03e9adf9bd91f43ed1a913f8b16787030f2a78a4549ec483c0d2a5d3
526,common_voice_en_32749601.mp3,Mature male with good pronunciation and convincing voice,3271c25301a8780b3807251627560b2bc216deb1fd01d9ff2f7a317744c035ccddb08ac4c34aaf8be337791a59ea3e9845bac71de91505c33ccb5ee8eb7696b7
527,common_voice_en_17945610.mp3,Mature man with low voice but higher pitched tone and uncertain voice ,5cb9f39b3aba7d8a2e1bd68456b76227d48449780fe5622f3efec5fa7bf431bf2c0dc630cae5e59bd4e26dc7315be32541ddab3ef4efdd875057ada76a72e00c
528,p281_321_mic1.flac,"young man with a bit of an Australian accent, lower bassy voice.",p281
529,p278_231_mic1.flac,Adult male with lower voice speaks sluggishly,p278
530,common_voice_en_17266315.mp3,"Male voice that gets higher pitched, a bit squeaky, questioning.",c0f152b0fda37a1db3849341e9cd56082fc2420bdd224af4f68be87d57a32c4ada8363d09d62ba512b954a00f0adf94b74bf971be2ca61b865b1c0bc29f077cf
531,common_voice_en_19652664.mp3,Adult man with medium pitched voice has a bit of an unclear pronunciation,41a6ffbce1c395d6e21a46b956ca0b51e40ebe075b6616c3789949fc5a0d37af6d2bf2c3262b4e52a8f7aa3a083b9797f5ff560a36fe79adb8cee8c99ac7b282
532,common_voice_en_17253924.mp3,"Young woman with childlike cartoonish voice, sounds excited.",1645aca50c6f33f976d363267936d93e909dcd2369c82161bbf42fce536bfaac95237c50b18b34311ddd9cd919b8413352512bb5c11e4f7b16cc9f337bceca8c
533,common_voice_en_22238312.mp3,"Adult female with lower soft voice, strong accent and unclear pronunciation.",1db46ebfd92940c41a433902c2f4db9cbdbf3672ac7ee25d962331dec010bb7896947be2873ea8c02e8cc14750a84d05172ababcb0c0de28309643bb0679305c
534,common_voice_en_18681194.mp3,Mature male voice speaks with charm and seems knowledgeable ,ae13a4a776cf3019e7003e952cb2def0333cc044ddab4e84c2d9e900baad18d586fac6fbd80404141c91b0accd3bab1dd663aa83b10a7de6ca3a1064e1a8a39e
535,p334_339_mic1.flac,"Lower, a bit coarse male voice, fast speaking.",p334
536,common_voice_en_21795747.mp3,Mature woman with lower voice speaks slowly and calmly,7eff9a54bdb0619deffda7609d5b8565278e3328de99e63908be2a37c1ad16516240b9c92bc6b68d8130b20dc556f57005dc053f4874a49589f5971a31b97e98
537,p244_100_mic1.flac,"Boyish sounding voice, either a very young boy or lower voices female, a bit nasal sound.",p244
538,common_voice_en_26031426.mp3,"Adult woman speaks unclearly with an accent, has a high pitched squeaky voice.",29b8505586cd43382cd695da6b943f401104be710a5b60e814ac5fe7e06b39459cf8fe1701ca83f8154b3ccd749df7c2aef33ff23950bb1a135b1e1c393dbcf6
539,common_voice_en_21371780.mp3,"Adult man with accent, low bassy voice, with a bit of background echo.",2f5b4a834b09c01981290d69bc8d545f2f9897d8e9397f7fd143fce72f05535ef3424aa4befc8f255e483e245b541b947a98318bc60e299486a241b080344c4f
540,common_voice_en_36683.mp3,Young man with higher clear voice with unclear pronunciation sounds unsure.,8217ed3f83afa3d43c631992d72b51ae3c6b5fea1d10ad264852cbe3bab773b449bba09d7332843df40ad90b0863bbac3f5ac3e589a25c533452026b6a9cad0c
541,common_voice_en_546138.mp3,Mature male with squeaky voice and unclear pronunciation,7b40d28fdb712b6b947dbe66786103bb8cb5d9f826c67e9e2888f58b8b9851c7bc725dcbfc7e774fc8e2f63d23d832ffdc9c0bcb3795e6b94380bf2397fdaa02
542,common_voice_en_532382.mp3,Adult female with deep voice and clear pronunciation with piercing speech,dd2d8faaa2e134b5668b0b12ef7b180a6dc1ba85af28d31c2539a73b8fae62ad7aedd33f03749ba6b62f694752e71b176770c1b699838efa99035d7e881cfd02
543,common_voice_en_26568225.mp3,Adult female with high pitched voice and unclear pronunciation,cea18d12298f2bbae520713a1cfcf05e63b2b9470dcc0adadabc81e69d8d57a0f3c22c06bc4f280d08b9084d3e16b22b3c5d60f7711c9db8dba0d3f53075a34e
544,common_voice_en_18846801.mp3,Teenager male with deep flat voice speaking monotonously,50b7e72cea733fc1dfa54d8e33c3f13309755ca75eb17cf6b797c475274b3d0b54dd0a8ff61c261849a770e023957f4bad823e748fd32e350650716fc133e1b4
545,common_voice_en_22204173.mp3,Adult male with British accent and high pitched voice stumbles while speaking,6657f621ac638f7cc7cdb9d633d73f4d4d7f88b1764a8b25c366ccb692f1df0813d5d7b4f3f3cd09a62149d65417f59897aef9672b244cc8a7ec865bf716540d
546,common_voice_en_30725801.mp3,Adult male with squeaky high pitched voice speaking monotonously,d7b8bd57a847b9f6a92eb975f2fe0a8686ee95a9e71b0168d5ee36090c94b373186a93d864491807465a14b0cb0cd867c6a52509095f73cb3c58490f0fb7f149
547,common_voice_en_17856214.mp3,Mature male with British accent and deep voice with clear pronunciation,76c9f8a8f018cb1a1837f237862266e5e4558b176f18afa1692f9061136d7ed1220f71b4dc61d1afd073d6632d2cb497c30d8222c299c6a65184c32128c535a7
548,p247_208_mic1.flac,Adult male with high pitched voice speaks monotonely,p247
549,common_voice_en_25889925.mp3,Adult female with high pitched monotone voice,3e221ed17d57feeb590b6db734ae530b91b452015671745dffcff6f1c38339203936c0029d0ec2a6da6a1ed27b53f026bacdfbdfe8ca22df6a5fa96526293d6f
550,common_voice_en_547350.mp3,Adult male with deep flat voice speaks emotionless,9db071da66e5b08a2abe0685a5f845403656201988e5785b221c48ed1333f97990248c8b62cede0628fac8a77ce4da5f3369ebcbc964bccfa6105243bccacdef
551,common_voice_en_73973.mp3,"Adult male with English accent and squeaky, high pitched voice",b1db7c137d8255e6b9dd5e09801e60fc1ccea06e399aac035221758b0e6fa7fbe47ab497226a2bc864de5f288f4ccd26d05c6318b360321b31d0d3540291a48b
552,p341_144_mic1.flac,Adult female with clear pronunciation and convincing speech,p341
553,common_voice_en_29210291.mp3,Adult male with Southern accent blows into microphone while speaking,92f8d561db8e4ee475c49c70d8403049a7af2af2f966443a8ab1fe0ded10bc7aa5e73736f43fdf00069133e72b9cf7291f04a431eb834ba6a0f41e4c2a8004b4
554,common_voice_en_27639213.mp3,Adult male with bass monotone voice speaks convincing,3966424d450892790e1d1219e21c7bb3fb8e187df334877f7783245b09e9c1503756b649bacee324615a4307b6c810b2fa1dfb0ce01fc55e33a5fbe2ae3ea366
555,common_voice_en_21976991.mp3,Adult male with high pitched flat voice speaks convincing with background noise of hiss,49518b0d6dc530fcb03351c761b8b69aba18a29400ec4510ccfc214f1905114cc6fb992128c51bbba73e54db9cb9e534446ebc5f27748ea922d1913e0635ac2e
556,common_voice_en_23960327.mp3,Mature female with squeaky high pitched voice,dedeb63a82dc2853b15709195f2d3ed8a065a1fcbc25b2f646ebce06df212d0d1b5d0ea5039472305c48f09f5ded69321566a5fc635fd0436bff5b354ec1dea7
557,common_voice_en_24570495.mp3,Mature male with serious deep monotone voice speaks slowly,a2576ccf04ad8c0dbe2b29f3843c1ed984d8bd91480766f4bf99c933d99ae8d2b32afc34c7e185b06c2b16deae4fbabb8030906be2455973e2d85d92b0afbc6e
558,common_voice_en_23359003.mp3,Adult female with high pitched monotone voice speaks slowly,cf658764e695270837ad8af4462cb4fdaeec21a451e3c9ee585dcec3b999e0ac6f0a5f2de7548e919d2ffa1cc94d7f78fb8dbc1eba8bfe3cf0875c9c50235b63
559,common_voice_en_20536681.mp3,Mature female speaks convincing and slowly with background noise of mouse clicking,7eff9a54bdb0619deffda7609d5b8565278e3328de99e63908be2a37c1ad16516240b9c92bc6b68d8130b20dc556f57005dc053f4874a49589f5971a31b97e98
560,common_voice_en_24893093.mp3,Adult male with low pitched deep voice and monotone speech,ed838c723e4f3a7d6ea303d545f346d096b8451bd9f8cbd00d73849c953f5f6d8632eca6813d188ff52b71e8e31a8f6b2ff03ba48c43aa997c89d773cc0204cb
561,common_voice_en_48707.mp3,Older female voice with a confident but a bit wobbly sound speaking clearly with some background noise,bb11b3d2b69d5c672eb4924af6bf46447a193f29e08ae1bc0a834a271aaea698c9ab4583bb2cfef9d18d10a4ac043db1624968a1eb5fe33ded79f7e4e737f31a
562,p258_003_mic1.flac,Adult male voice with crisp clear sound speaking calmly and understandably,p258
563,common_voice_en_184531.mp3,Adult female voice with an accent and quiet smooth sound,ba521909780b884e36243128b4bfd83cf8d8f2900ea3e17de011549e0eabf2986f5d08e26bdf29d29a80d087c1e289d52a916c74fcec99bf4f4fc5f3c4c794b7
564,common_voice_en_19689806.mp3,"Older woman with an American accent speaking with piercing ""s"" sounds",e373c8e024eba0168cef30c5cc77403153663d95669a404255c85d2552ca6c5fa6764637c2a41698932eae905a5d21975e5a9f675715a9c3954e596e03bd9c44
565,common_voice_en_19789408.mp3,Adult male voice with low pitch speaking calmly and clearly,5bb1f4cfded1bc476db8619e81f47ce7cce6dd60ff069adfe11efd91a3ecf98cefe2892291c99212bce397bce5d5c24be40638f2ac1a14cb2a09cf41b63ab930
566,common_voice_en_25771682.mp3,Adult male voice speaking calmly and carefully with some short pauses,ac3e50a17364a92d82f4d9c03f50b863177cba766805b32199230a94d178c4f994bd0d530e274e353dd20feaf0ff953ecdf62f52536e9e7f436a3bf4bf46cc87
567,common_voice_en_27150782.mp3,Adult male with a deep echoey voice and an Indian accent that can be hard to understand at times,6ac8b1a295e2a4a5b11a602a368771530cd7b900ee5d8b552946eb8d32c21f4694c786c41ca996b12adb8a1d1e15160f84cb0632d9359cf84c6d99a18745692e
568,common_voice_en_511357.mp3,Mature woman with a lower pitched smooth voice speaking quietly ,76dc1a1d95e971afd52e3af7321b340b2969459991d80578762c1c5dd4fe1fae1a9baa10126bff15baf19c9688fa900e4f231e83d757bfa1d3a1befa641097a2
569,common_voice_en_27296957.mp3,Mature woman with an American accent and lower pitch speaking quite slowly with short pauses,7a21653151411fd001cefbe1b05ddffd7485120438568e07c398a381f83a65a1a257e1f73e8f28c0dfc0696f3c55d54efccda0ef6d4cb1c0a9dd8949ef0ffaeb
570,p231_428_mic1.flac,Adult female voice with an accent and soft smooth sound speaking not very understandably,p231
571,p275_278_mic1.flac,Adult male voice with some kind of British accent and medium-high pace,p275
572,p293_055_mic1.flac,Deeper female voice with an accent with a relatively flat tone,p293
573,common_voice_en_15735573.mp3,Adult male voice with a deep smooth sound speaking with fast pace,dcac4ff5a9838d81c23810b05e38208bdc9342e7b45d655aab4ba7b8ed9d4b8688d7275bf9d0f5cfc9b8a23a4fbe395adb8ed17a11b02241ea1fe18f2b9ad997
574,p275_123_mic1.flac,Male voice with a deep sound speaking in a quick burst,p275
575,common_voice_en_19825117.mp3,Older man with a deep raspy voice speaking unclearly in one long string of words with a short pause,19dd0e462db7e64a858ec4d6943c5488b801ea9ce3a2ba0aa7a45a60ac4ba0ddedab74443a5638ddf97de60a91f1c6cae3b46a148a039890f84fa365e23c8ff0
576,common_voice_en_24451396.mp3,Female voice speaking in a very unclear way with buzzing noise,30cf92caa81bb2bef0f868e2e97e200dc6f77a01d6f188c1977cdace5bba9eb317190fd2c260eba1c3cb9f6ab22c6733a8a228049e1ad115fbcc13f4d3f53943
577,common_voice_en_25231609.mp3,Childlike female voice with high pitch speaking softly,3bc30a3a592bd5da650cb4196dfa11ded233081ca8fab803b077bf748fe66a95f76e0f19fd58ee9efa9a6c5b82790fafae8194379d48a724fdf9ae58b0f33cfb
578,common_voice_en_495428.mp3,Older man with a raspy voice and a British accent speaking slowly and clearly,9f33b0c4883d8959458bf97f0e389faade1a3ea632826483baedd07ce741e22939e2a8dcaede58392fda9e1f8ddd87272f46d22eba7740db8a008d5df21e894f
579,p314_023_mic1.flac,Adult female voice with a British accent and a soft clear sound speaking smoothly with medium-slow pace,p314
580,common_voice_en_31075906.mp3,Adult male voice with a raspy sound speaking quietly in a very relaxed way,48d95f6ea8539147042e6d83d6fe9ede751beba89fcbd5df757c8befcbc33ef2477627a851bc3f6e2ed19b5c61305bd388d0ad3a10626af55808d5180994e0a1
581,common_voice_en_559602.mp3,Adult male with German accent and neutral voice.,88fd82663501223a0d85068dd74e1f33ec7e19b423bd474f6abee404149293f5827d0dc960a6cd4d8c75069fd95f99a769c7471032c45d282be52840c8a78af2
582,common_voice_en_28775937.mp3,Mature male with British accent and deep voice asks a question.,d8dfd505efdb447a1db9abd9c89eaf88bd331c75cf4f506896bccb4f2abe8062aeb094efe87e3d75757636777ce215f353575aceb11a5293d582426c558708c1
583,common_voice_en_21807700.mp3,Adult male with American accent speaks quietly and with echo.,2987640c2ff5ff5d513de957ed974044bed7f2442b97b48cac41ff461ff563f56da8e689c4b1548dd03cff28cf0cd754e2152d838fa2b7dd6ac682506c7fa89a
584,common_voice_en_169756.mp3,Adult male with German accent and emotionless voice speaks slowly.,f9932d1ebb456887face6bc5ce556e7a93e7a821d4b736a368cb5ae081562917ef5c869c9dc9f0984584a9ea531c94460edc3745d76d72aba9c4009008687828
585,common_voice_en_64645.mp3,Adult male with lively voice speaks quietly.,6f2d4ab79a55dcad712398fb0daab78f377cfeff0b0babd9fbc89ed875cdf8451324f3acb81dc00477297c994ad1025d51de0c32f7b58a72b73ce4b2ec55c6ec
586,common_voice_en_19533780.mp3,Mature male with American accent and neutral voice speaks informatively.,c895f6ffc789443e064895d7a9eef515f9c01c86ff78b4141d2428a6fab1f9a4a6a52723124cba3640a86204d4ff027b96172a2738cb57943a336e044d934f24
587,common_voice_en_571063.mp3,Adult male with the deep booming voice of a movie trailer narrator speaks with emphasis.,39dbafe749c99b7892237677cc5dd7ba606444550c127826e0b2e81ab78b96708d5fd4ae2588f24034a42ac10621ee52bf9a302ef078d5862a586729d64aee81
588,common_voice_en_528434.mp3,Young male with Indian accent speaks slowly with background noise.,4357beb8693ec15761731c02972e40af80696b094110269c970e559e0a9e861a0f10c06933ac80e8940b990c27964a964a02789b39422bdec03b8f0f5e64764e
589,common_voice_en_20433600.mp3,Young adult male with unclear pronunciation speaks quietly and quickly.,244ae33efb54da26b0b3f968bda557161a142be8a7009a6e31e3e215d52ecbeb0551838f11d31267c7991d3abc58c2284b66abe6cb30bdaf598f326705680050
